Carimbo de data/hora,Nome da empresa (opcional) ,A quanto tempo sua empresa é cliente Massa FM?,Qual segmento do seu negócio?  ,Como você avalia sua satisfação geral com a Massa FM?  (0 a 10),O retorno obtido com os anúncios atendeu suas expectativas?  (0 a 10),Como você avalia o atendimento da equipe da rádio? (0 a 10)  ,  A divulgação/alcance da rádio atendeu suas necessidades? (0 a 10)  ,Você indicaria a Massa FM para outra empresa? (0 a 10)  ,O que poderia ser melhorado?  
12/05/2026 13:06:01,Doce encanto ,Menos de 3 meses,"Alimentação (restaurantes, bares, lanchonetes)",9,3,10,3,5,Não sei informar 
13/05/2026 16:29:57,Jg uniformes ,De 3 a 6 meses,Outros,5,1,10,1,5,"Acho q as músicas, talvez pq sejam as músicas do momento, pq meu gosto musical é muito diferente. "
13/05/2026 16:41:18,,De 6 meses a 1 ano,Serviços (geral),10,10,10,10,10,
14/05/2026 15:56:31,AEMB,Menos de 3 meses,Outros,8,8,8,7,8,Não entendomuito
18/05/2026 21:59:50,,De 3 a 6 meses,Varejo (lojas em geral),10,7,9,7,10,
19/05/2026 13:24:20,,De 3 a 6 meses,Varejo (lojas em geral),10,8,10,8,10,
19/05/2026 19:48:17,,De 3 a 6 meses,Varejo (lojas em geral),10,8,9,8,7,